resource,name,summary
move,defog,"**Defog** is a Flying-type move with no power and 100% accuracy. It removes hazards such as Spikes, Stealth Rock, and Sticky Web from the battlefield and lowers the target's evasion by one stage. Defog does not deal any direct damage but is highly valued for its utility in clearing entry hazards, which can be crucial in both competitive and casual play. Additionally, it clears Light Screen, Reflect, Tailwind, Aurora Veil, and similar effects from the opposing team. It is often used by support Pokémon to maintain field control and hinder the opponent's strategy."
move,trick-room,"**Trick Room** is a Psychic-type status move with no power or accuracy. When used, it reverses the speed priority within the battlefield for five turns, causing slower Pokémon to move before faster ones. This can strategically benefit teams with slower Pokémon, allowing them to attack first. Trick Room is often used in competitive play to give an advantage to typically slower, bulky Pokémon and to counter fast and frail opponents. It has a priority of -7, meaning it is one of the last moves to be executed in a turn."
move,draco-meteor,"**Draco Meteor** is a Dragon-type move with 130 power and 90% accuracy. It is one of the most powerful Dragon-type special attacks in the Pokémon games. However, using Draco Meteor comes with a significant drawback: it sharply lowers the user's Special Attack stat by two stages after the move is executed. This high-risk, high-reward dynamic makes it a strategic choice in battles, often used to deal massive damage at a critical moment. Draco Meteor is typically taught via a Move Tutor, and it's favored by many Dragon-type Pokémon, including signature users like Salamence and Garchomp. Its potent combination of strength and tactical disadvantage requires careful planning and timing to use effectively in both casual and competitive play."
move,discharge,"**Discharge** is an Electric-type move with 80 power and 100% accuracy. It has a 30% chance of paralyzing each Pokémon adjacent to the user, making it particularly effective in Double Battles. Discharge can hit all Pokémon in a battle, not just the opponent, which requires strategic planning to avoid harming allies. It is known for its utility not only due to its decent power and paralysis chance but also for its ability to damage multiple targets at once. This move is often used by Electric-type Pokémon with abilities or strategies that mitigate its spread damage, such as using Pokémon with the Volt Absorb or Motor Drive abilities as partners."
move,lava-plume,"**Lava Plume** is a Fire-type move with 80 power and 100% accuracy. It has a 30% chance of burning the target. Lava Plume is notable for its decent power and high burn chance, making it a useful move for both inflicting damage and status effects. It targets all adjacent Pokémon in double battles, which can make it a strategic choice for spreading burns across opposing teams. It is particularly beneficial for Fire-type Pokémon that can take advantage of the potential burn status to weaken physical attackers."
move,leaf-storm,"**Leaf Storm** is a Grass-type move with 130 power and 90% accuracy. It is a special attack that deals significant damage but sharply lowers the user's Special Attack stat by two stages after use. This recoil effect makes Leaf Storm a high-risk, high-reward move, often used strategically to deliver a powerful blow before switching out the user. Its high base power makes it one of the strongest Grass-type moves available, suitable for sweeping or taking down bulky opponents. Leaf Storm is commonly used by Grass-type Pokémon with high Special Attack stats in both casual and competitive play."
move,power-whip,"**Power Whip** is a Grass-type move with 120 power and 85% accuracy. It is a physical move introduced in Generation IV and is notable for its high base power, making it one of the strongest Grass-type moves available. However, its lower accuracy can make it a bit risky to use. Power Whip is often found on Pokémon with strong physical attack stats, giving them a potent weapon against Water, Rock, and Ground-type opponents. Despite its risk due to accuracy, its high damage output makes it a valuable move in both casual and competitive play."
move,rock-wrecker,"**Rock Wrecker** is a Rock-type move with 150 power and 90% accuracy. It is a Hyper Beam-equivalent move for Rock-type Pokémon, meaning that after using it, the user must recharge on the next turn and cannot take any action. Rock Wrecker is one of the most powerful Rock-type moves available, making it particularly useful in situations where a strong, decisive hit is needed. However, its recharge requirement makes its strategic use crucial to avoid leaving the user vulnerable. This move is notable for its high-risk, high-reward nature, as the user must carefully plan when to deploy it."
move,cross-poison,"**Cross Poison** is a Poison-type move with 70 power and 100% accuracy. It has a high critical hit ratio, making it more likely to land critical hits compared to other moves. Additionally, Cross Poison has a 10% chance of poisoning the target. This move is notable for its combination of reliable accuracy, decent power, and the potential for both status effect and critical hits. It is especially effective against Grass- and Fairy-type opponents, thanks to its Poison typing. In competitive play, Cross Poison is often used by Pokémon that benefit from dealing status effects or are built to take advantage of critical hit mechanics."
move,gunk-shot,"**Gunk Shot** is a Poison-type move with 120 power and 80% accuracy. It has a 30% chance of poisoning the target, making it one of the strongest Poison-type moves available. Despite its slightly lower accuracy, Gunk Shot is valued for its high base power and substantial chance to inflict poison, which can be crucial in both offensive and defensive strategies. This move is commonly seen on physically oriented Poison-type Pokémon and can be particularly effective against Fairy and Grass-type opponents, which are weak to Poison attacks."
move,iron-head,"**Iron Head** is a Steel-type move with 80 power and 100% accuracy. It has a 30% chance of causing the target to flinch, making it a valuable move for disrupting opponents, especially if the user is faster. Introduced in Generation IV, Iron Head is widely used for both its reliable damage output and its secondary effect. This move is commonly associated with various Steel-type Pokémon and is often favored for its perfect accuracy and the added utility of potential flinching, which can turn the tide in battles."
move,magnet-bomb,"**Magnet Bomb** is a Steel-type move with 60 power and perfect accuracy as it never misses. This unique attribute makes it highly reliable in situations where accuracy might otherwise be compromised. Magnet Bomb is a physical move, and while its power is relatively moderate, its guaranteed hit rate can be strategically advantageous in battles where evasion or accuracy drops are factors. It is one of the few moves that bypass the accuracy and evasion checks, ensuring consistent damage delivery. Introduced in Generation IV, Magnet Bomb is often associated with Pokémon that have magnetic or mechanical traits, such as Magneton and Magnezone."
move,stone-edge,"**Stone Edge** is a Rock-type move with 100 power and 80% accuracy. It has an increased critical hit ratio, meaning it is more likely to land a critical hit compared to standard moves. Stone Edge is commonly used for its high damage potential and the ability to bypass defensive boosts when it lands a critical hit. However, players need to account for its relatively lower accuracy, which can sometimes result in misses at crucial moments. This move is a popular choice in both casual and competitive play for Pokémon that have a strong physical attack stat and benefit from Rock-type coverage."
move,captivate,"**Captivate** is a Normal-type move with no power and 100% accuracy. It targets all opposing Pokémon of the opposite gender, sharply lowering their Special Attack by two stages. Captivate is mainly useful in double battles and mixed-gender matchups, as it relies heavily on gender differences between the user and the target. This move is not effective against genderless Pokémon or Pokémon of the same gender as the user. Despite its situational nature, Captivate can be strategically valuable for reducing the threat posed by special attackers."
move,stealth-rock,"**Stealth Rock** is a Rock-type status move with no power or accuracy value since it always hits. Instead of dealing immediate damage, Stealth Rock sets up an entry hazard on the opponent's side of the field. This move causes any Pokémon that switches into battle to take damage based on their susceptibility to Rock-type moves. The damage varies, being 12.5%, 25%, 50%, or 6.25% of the Pokémon's maximum HP, depending on its type resistance or weakness to Rock. Due to its ability to chip away at opponents' health and break Focus Sashes or Sturdy abilities, Stealth Rock is a staple in competitive play. It is particularly effective against Pokémon types that are weak to Rock, such as Bug, Fire, Flying, and Ice."
move,grass-knot,"**Grass Knot** is a Grass-type move with variable power and 100% accuracy. Its power depends on the weight of the target Pokémon; heavier targets receive more damage, ranging from 20 to 120 base power. Grass Knot is especially effective against heavy Pokémon like Snorlax or Groudon. This move does not affect Grass-type Pokémon in key generations, and it deals physical damage but is classified as a Special move. Grass Knot is popular in competitive play for its strategic use against bulky, heavy opponents."
move,chatter,"**Chatter** is a Flying-type move with 65 power and 100% accuracy. Unique to the Pokémon Chatot, this special move has a 100% chance of confusing the target. In earlier generations of the game, players could record their own voice to enhance the confusion effect of Chatter, making it one of the few moves with a real-world interaction component. However, due to concerns about inappropriate recordings, this feature was disabled in later generations. It's one of the few moves that blend gameplay mechanics with unique player interaction, contributing to Chatot's distinctive battle style."
move,judgment,"**Judgment** is a unique Normal-type move with 100 power and 100% accuracy. What sets Judgment apart is its ability to change type based on the Plate or Z-Crystal held by the Pokémon using it. This feature allows Judgment to become any type, making it highly versatile in battle. Judgment is the signature move of the Mythical Pokémon Arceus, known as the ""Original One."" Due to its adaptability and high power, Judgment is a formidable attack that can exploit various type weaknesses, making Arceus a formidable opponent in both casual and competitive play."
move,bug-bite,"**Bug Bite** is a Bug-type move with 60 power and 100% accuracy. When Bug Bite is used, the user bites the target and if the target is holding a Berry, the user eats it and gains its effect. This move is known for its strategic utility, especially in battles where Berries are common. In addition to its solid damage, the ability to consume the target's Berry can disrupt opponents' plans and provide the user with beneficial effects. Bug Bite is often used by Bug-type Pokémon and is available as a tutor move in various Pokémon games, making it accessible to a wide range of Pokémon."
move,charge-beam,"**Charge Beam** is an Electric-type move with 50 power and 90% accuracy. This move has a special effect, with a 70% chance of raising the user's Special Attack by one stage when it hits the target. While its base power is relatively low compared to other Electric-type moves, the potential to boost the user's Special Attack makes it a strategic choice in battles, allowing for increased damage output in subsequent turns. Charge Beam is often used by Pokémon with high Special Attack stats and can be particularly effective when setting up for a sweep or when aiming to handle multiple opponents."
move,wood-hammer,"**Wood Hammer** is a Grass-type move with 120 power and 100% accuracy. It is a physical attack that deals substantial damage, but it also causes the user to take recoil damage equal to one-third of the damage dealt to the target. Wood Hammer is commonly used by physical Grass-type Pokémon that can endure the recoil damage due to their high HP or defensive capabilities. This move is particularly effective against Water, Ground, and Rock types, providing excellent type coverage. Despite its downside, Wood Hammer’s high power makes it a valuable move for delivering heavy hits."
move,aqua-jet,"**Aqua Jet** is a Water-type move with 40 power and 100% accuracy. What sets Aqua Jet apart is its priority, allowing it to strike first in battle regardless of the user's speed, similar to moves like Quick Attack. This makes Aqua Jet particularly valuable for attacking first, especially when the user has low speed or needs to finish off an opponent. It's often used by Water-type Pokémon to gain a tactical advantage in competitive battles."
move,attack-order,"**Attack Order** is a Bug-type move with 90 power and 100% accuracy. This move is exclusive to Vespiquen, making it a signature attack. **Attack Order** also has a high critical-hit ratio, increasing the likelihood of landing critical hits, which deal extra damage. In addition to its solid base power and perfect accuracy, the move's high critical-hit chance can frequently turn the tide of battle. It is thematically designed around Vespiquen commanding a swarm of Combee to attack the target, fitting the Pokémon's queen bee aesthetic."
move,defend-order,"**Defend Order** is a Bug-type move with no power or accuracy value because it is a status move. This move sharply raises the user's Defense and Special Defense by one stage each, effectively boosting the Pokémon's ability to withstand both physical and special attacks. Defend Order is exclusive to Vespiquen, reflecting the thematic element of commanding its Combee underlings to protect the hive. This move is especially useful in battle scenarios where Vespiquen needs to enhance its endurance against a variety of attack types."
move,heal-order,"**Heal Order** is a Bug-type move that does not deal damage but is used to restore the user's HP by 50% of its maximum health. It has no power or accuracy ratings since it is non-damaging. Heal Order is distinctively associated with Vespiquen, the only Pokémon that can learn this move. This exclusive healing move plays a strategic role in prolonging Vespiquen's endurance in battles, making it a valuable asset in both casual and competitive play. The aesthetic and animation of Heal Order typically depict Vespiquen summoning a swarm of her underlings to aid in the healing process, adding a unique flavor to this Bug-type recovery move."
move,head-smash,"**Head Smash** is a Rock-type move with 150 power and 80% accuracy. It is one of the most powerful Rock-type moves, but it also has a notable drawback: the user takes recoil damage equal to 50% of the damage dealt to the target. This high-risk, high-reward move is typically used by Pokémon with strong physical attack stats. Notably, Pokémon with the ability Rock Head can use Head Smash without suffering recoil damage, making it an exceptionally potent option for them. Despite its lower accuracy, Head Smash's immense power makes it a popular choice for players looking to maximize damage output in a single turn."
move,double-hit,"**Double Hit** is a Normal-type move with 35 power and 90% accuracy. The move strikes the target twice per use, which means its effective power is 70 if both hits connect. Double Hit has a chance to trigger the Ability Technician for certain Pokémon, increasing its damage output. It is a staple move for Pokémon that can benefit from multiple hits in a single turn, especially in triggering abilities or held items that respond to multiple attacks."
move,roar-of-time,"**Roar of Time** is a Dragon-type move with 150 power and 90% accuracy. This move is uniquely associated with Dialga, the Legendary Pokémon, and is known for its immense strength. When used, Roar of Time requires the user to recharge on the following turn, which can leave Dialga vulnerable to attacks. Despite this drawback, its high power makes it one of the most formidable Dragon-type moves in the game. In competitive play, it is essential to use this move strategically due to the mandatory recharge period, balancing its destructive capability with the risk of giving the opponent a free turn."
move,spacial-rend,"**Spacial Rend** is a Dragon-type move with 100 power and 95% accuracy. It has a heightened critical hit ratio, making it more likely to land a critical hit compared to standard moves. This signature move of the Legendary Pokémon Palkia not only boasts impressive power but also benefits from the natural type advantage Dragon moves have over Dragon-type Pokémon. Spacial Rend is particularly notable for its distinctive animation, which depicts Palkia tearing through the fabric of space. This move is highly valued in both competitive and casual play for its combination of power, accuracy, and increased critical hit chance."
move,lunar-dance,"**Lunar Dance** is a Psychic-type move with 0 power and 0% accuracy because it does not deal direct damage. When used, the user faints and in return, fully restores the HP and cures the status conditions of the Pokémon that is sent out next. Lunar Dance can be a strategic and game-changing move in competitive play, providing a fresh start for a key team member at the cost of sacrificing the user. This move is often associated with Cresselia, as it is one of her signature moves."
move,crush-grip,"**Crush Grip** is a Normal-type move with its power varying depending on the target's remaining HP, ranging from 1 to 120. It has 100% accuracy. The move's power is determined by how much HP the target has left, being most powerful when the target is at full health. Crush Grip is the signature move of Regigigas, and it is known for its potential to deal significant damage if used strategically against opponents with high HP."
move,magma-storm,"**Magma Storm** is a Fire-type move with 100 power and 75% accuracy. This move traps the target in a swirling vortex of fire for 4-5 turns, causing additional residual damage equal to 1/8 of the target's maximum HP at the end of each turn. Magma Storm is notable for its ability to effectively trap and wear down opponents over time, making it a powerful tool in competitive play when used strategically. It is particularly associated with the legendary Pokémon Heatran, which can utilize its effects to great advantage, creating opportunities to chip away at the opponent's health while preventing them from switching out."
move,dark-void,"**Dark Void** is a Dark-type move with 50% accuracy that induces sleep in the target Pokémon. It does not deal any damage but can hit multiple targets in double battles, making it a strategic choice for incapacitating opponents. Dark Void was originally exclusive to Darkrai, a Mythical Pokémon, further adding to its uniqueness. Due to its high potential to disrupt opponents, the move has been heavily restricted in official Pokémon tournaments, and its accuracy was significantly nerfed from 80% to 50% in Generation VII to balance its gameplay impact."
move,seed-flare,"**Seed Flare** is a Grass-type move with 120 power and 85% accuracy. It has a notable secondary effect with a 40% chance to sharply reduce the target's Special Defense by two stages. This move is exclusive to the Mythical Pokémon Shaymin, particularly Shaymin's Sky Forme, making it a signature move. Seed Flare's high power combined with its potential to significantly lower the opponent's Special Defense makes it a formidable option for dealing significant damage in consecutive turns. Due to its lower accuracy, there is a risk factor involved, but the high reward often makes it worth the gamble in battle strategies."
move,ominous-wind,"**Ominous Wind** is a Ghost-type move with 60 power and 100% accuracy. It has a 10% chance of raising all of the user's stats (Attack, Defense, Special Attack, Special Defense, and Speed) by one stage. Ominous Wind is particularly known for this secondary effect, which can turn the tide of a battle if triggered. It's a special attack move and has a PP (Power Points) of 5, which can be raised to 8 with PP Up or PP Max. While not as powerful as some other Ghost-type moves, its potential to boost the user’s stats makes it a valuable option in certain strategies and situations. It is favored in some competitive play for its potential to snowball a victory through stat boosts."
move,shadow-force,"**Shadow Force** is a Ghost-type move with 120 power and 100% accuracy. It is a two-turn move where the user vanishes on the first turn, making itself invulnerable to most attacks, then strikes on the second turn. This makes it similar to moves like Fly or Dig but with Ghost-type mechanics. Additionally, Shadow Force can break through protective moves such as Protect or Detect, ensuring it lands even against defensive strategies. This move is exclusively known by Giratina, the Legendary Pokémon, highlighting its unique and powerful nature in battle scenarios."
move,hone-claws,"**Hone Claws** is a Dark-type status move with no power and perfect accuracy. It raises the user's Attack and Accuracy stats by one stage each. Introduced in Generation V, Hone Claws is particularly valuable for physical attackers who benefit from boosted offensive capabilities and improved hit rates, especially when using moves with lower accuracy. This move is often used strategically to set up for stronger attacks in subsequent turns, making it a versatile choice in various battle situations."
move,wide-guard,"**Wide Guard** is a Rock-type status move with no power and no accuracy check since it does not deal damage. It protects the user's team from all multi-target moves for that turn in double and triple battles, such as Earthquake or Surf. Wide Guard is particularly useful in competitive play, serving a strategic role in protecting the team from area-of-effect attacks. Unlike a traditional Protect move, it can be used consecutively without the chance of failure. However, it will not block single-target moves directed at the user or its allies. This move is especially popular in formats with team battles, providing crucial support for defensive strategies."
move,guard-split,"**Guard Split** is a Psychic-type status move with no power and perfect accuracy. This unique move combines the user's Defense and Special Defense stats with those of the target, then equally distributes the total between both Pokémon. As a result, both Pokémon end up with the same Defense and Special Defense stats, which can strategically weaken an opponent with high defenses or bolster a user with low defenses. Guard Split does not affect immunities to stat changes or other modifiers such as Reflect or Light Screen. This move is particularly useful in double battles or for Pokémon that rely on balancing out their defensive stats."
move,power-split,"**Power Split** is a Psychic-type status move with no power or accuracy rating, as it does not deal direct damage. This move averages the user's Attack and Special Attack stats with those of the target Pokémon, thereby balancing their offensive capabilities. Power Split can be strategically used to weaken an opponent with high offensive stats or to boost a user with lower offensive stats, making it a versatile option in both casual and competitive play. Additionally, it works in conjunction with other moves and abilities, offering a unique way to control the flow of battle."
move,wonder-room,"**Wonder Room** is a Psychic-type status move with no power and perfect accuracy. When used, it swaps the Defense and Special Defense of all Pokémon on the field for five turns. This swap can significantly impact battle strategies, especially for Pokémon with unbalanced defensive stats. Wonder Room does not affect other stat changes like boosts or reductions. It's commonly used in doubles and triples battles to disrupt opponents' strategies and is considered a niche but highly tactical move."
move,psyshock,"**Psyshock** is a Psychic-type move with 80 power and 100% accuracy. Unlike most special moves, Psyshock targets the opponent's physical defense rather than their special defense, making it a unique and strategic option for overcoming specially bulky opponents. This dual nature allows users to exploit weaknesses in the opponent's defensive stats, providing versatility in both casual and competitive battles. Psyshock has a PP (Power Points) of 10, and it can be learned by a variety of Psychic-type Pokémon, making it a widely accessible and popular move within the game."
move,venoshock,"**Venoshock** is a Poison-type move with 65 power and 100% accuracy. If the target is poisoned, Venoshock's power doubles to 130, making it especially potent in combination with moves or abilities that inflict poison status. This move allows for a strategic approach, leveraging status effects to deal significant damage. Venoshock is commonly used in both single and double battles, where its synergy with poison-inducing teammates can turn the tide of battle."
