resource,name,summary
move,pound,"**Pound** is a Normal-type move with 40 power and 100% accuracy. It is one of the most basic and widely known attacks, often taught to many Pokémon at very early levels. Pound deals direct damage without any additional effects or secondary consequences. Despite its low power, it serves as a reliable move for beginners due to its perfect accuracy. Pound is often one of the first moves that new trainers encounter and is a staple in many early-game scenarios before more powerful moves are learned."
move,karate-chop,"**Karate Chop** is a Fighting-type move with 50 power and 100% accuracy. While its base power may appear modest, it has an increased critical hit ratio, making it more likely to land a critical hit compared to other moves. Originally, Karate Chop was classified as a Normal-type move in the first generation of Pokémon games but was later changed to a Fighting-type move from the second generation onwards. It's a classic move that many Fighting-type Pokémon can learn early in their leveling progression, making it a staple in the move sets of many fighting Pokémon."
move,double-slap,"**Double-Slap** is a Normal-type move with a variable power as it hits the target 2 to 5 times consecutively. Each hit has 15 power, with the total potential power ranging from 30 to 75 if all five hits land. The move has 85% accuracy. Double-Slap can be beneficial for breaking through substitutes and items like Focus Sash or Sturdy, which would normally prevent a one-hit knockout. However, its variable nature and lower accuracy make it less reliable compared to other multi-hit moves. It is more commonly seen in early-game play and less in competitive environments."
move,comet-punch,"**Comet Punch** is a Normal-type move with variable power and 85% accuracy. It is a multi-strike move that hits the target 2-5 times in a single turn. Each individual hit has a power of 18, and if all five hits connect, the total base power can reach 90. The probability of hitting 2, 3, 4, or 5 times is 37.5%, 37.5%, 12.5%, and 12.5%, respectively. Comet Punch is often used for its potential to break through the opponent's Substitute or to take advantage of abilities that activate with multiple hits. Despite its randomness, it can be a valuable move for delivering multiple blows in quick succession."
move,mega-punch,"**Mega Punch** is a Normal-type move with 80 power and 85% accuracy. As one of the original moves introduced in the first generation of Pokémon games, it is known for its strong physical impact. Despite the name suggesting an exceptionally powerful move, its accuracy and power are relatively moderate compared to some higher-tier attacks. Mega Punch does not have any additional effects like status changes or stat boosts, and it is commonly used by a variety of Pokémon that rely on physical strength. While not as commonly used in competitive play due to the availability of more powerful and accurate moves, it remains a nostalgic and classic choice for many trainers."
move,pay-day,"**Pay Day** is a Normal-type move with 40 power and 100% accuracy. When used in battle, it scatters coins on the ground, allowing the player to collect additional money after the fight concludes. The amount of money collected is equal to five times the user's level, provided the user remains in battle when the opponent is defeated. Pay Day is often associated with Meowth, which learns the move at an early level. It is a popular choice for players looking to earn extra in-game currency without engaging in Trainer battles or other in-game activities."
move,fire-punch,"**Fire Punch** is a Fire-type move with 75 power and 100% accuracy. It has a 10% chance of burning the target. Fire Punch is a physical attack, making it useful for Pokémon with high Attack stats. The move is commonly used due to its reliable damage and the potential to inflict a burn, which can halve the Attack stat of the target if successful. It is also notable for being a punch-based move, meaning Pokémon with the ability Iron Fist will receive a boost to its power. Fire Punch is a versatile move found on various Pokémon, providing valuable type coverage."
move,ice-punch,"**Ice Punch** is an Ice-type move with 75 power and 100% accuracy. It has a 10% chance of freezing the target, which can immobilize the opponent. Ice Punch is a physical move, making it advantageous for Pokémon with high Attack stats. It is widely used due to its ability to deal significant damage and potentially inflict the freeze status, which is one of the most debilitating conditions in battle. Ice Punch is versatile, often appearing on a variety of Pokémon, including those that are not Ice-type, thanks to its availability through various move tutor programs and TMs in different generations."
move,thunder-punch,"**Thunder Punch** is an Electric-type move with 75 power and 100% accuracy. It has a 10% chance of paralyzing the target. Thunder Punch is a physical move, making it useful for Pokémon with high Attack stats. It has been a staple move for Electric-type physical attackers and is also favored by Pokémon with the ability to learn it through TM or breeding. The move is particularly effective in battles against Water- or Flying-type Pokémon, which are weak to Electric-type attacks. Thunder Punch combines reliable damage output with the added utility of potentially causing paralysis, giving it strategic value in both casual and competitive play."
move,scratch,"**Scratch** is a Normal-type move with 40 power and 100% accuracy. It is one of the most basic and frequently encountered moves, often known to or learned early by low-level Pokémon. Scratch has no additional effects beyond dealing damage, making it a straightforward and reliable attack. Despite its simplicity, it serves as an effective introductory move for new Pokémon trainers and is iconic due to its widespread use in the early stages of many Pokémon games."
move,vice-grip,"**Vice-Grip** is a Normal-type move with 55 power and 100% accuracy. It is a physical attack where the user grips the target tightly, inflicting damage. While Vice-Grip does not have any additional effects or secondary effects like status ailments, it's an early-game move that many Pokémon can learn, making it a staple for Pokémon just starting their journey. Despite its lower power in comparison to other moves obtained later in the game, Vice-Grip’s perfect accuracy ensures it reliably lands hits."
move,guillotine,"**Guillotine** is a Normal-type move with a power that is effectively infinite, but it has an accuracy of only 30%. This move is a one-hit KO (OHKO) move, meaning it will instantly faint the target if it lands successfully. Guillotine does not affect Pokémon that are of a higher level than the user, and it won't work against Ghost-type Pokémon due to its Normal-type classification. Although highly risky because of its low accuracy, Guillotine can be a game-changer if it hits. It is typically used in strategies that involve boosting evasion or lowering the opponent's accuracy to increase the likelihood of landing the move."
move,razor-wind,"**Razor Wind** is a Normal-type move with 80 power and 100% accuracy. It is a two-turn move: on the first turn, the user charges up, and on the second turn, it unleashes the attack. Razor Wind also has a high critical hit ratio, which increases the chance of landing a critical hit. This move can hit adjacent opponents in double battles, making it versatile in certain battle scenarios. Despite its interesting mechanics, Razor Wind is less commonly seen in competitive play due to the delay in its execution, which can leave the user vulnerable during the charging turn."
move,swords-dance,"**Swords Dance** is a Normal-type non-damaging move with no power or accuracy attributes since it does not deal damage. Instead, it significantly boosts the user's Attack stat by two stages, effectively doubling their physical attacking capability. Swords Dance is often used to set up for a sweep, allowing the user to deal substantial damage in subsequent turns. It is a classic move in competitive play, frequently utilized by physical attackers to enhance their offensive potential. The move is a staple in the movesets of many Pokémon due to its ability to turn the tide of battle by drastically increasing the user's damage output."
move,cut,"**Cut** is a Normal-type move with 50 power and 95% accuracy. It is a physical attack that deals damage without any secondary effects. Cut is also significant outside of battle as it serves as an HM (Hidden Machine) in several generations of Pokémon games, allowing players to cut down small trees that block pathways. While its battle utility is limited due to its relatively low power, its role in navigating the overworld keeps it relevant in many games."
move,gust,"**Gust** is a Flying-type move with 40 power and 100% accuracy. Initially introduced in Generation I, Gust was a Normal-type move but was changed to Flying-type from Generation II onward. This move is one of the most basic Flying-type attacks, commonly learned at early levels by bird-like Pokémon. While Gust lacks additional effects like causing status conditions, it receives a power boost when used during certain weather conditions, such as strong winds, due to its compatibility with the move Tailwind. It’s particularly useful in battles involving Bug and Grass-type Pokémon, which are weak to Flying-type moves."
move,wing-attack,"**Wing Attack** is a Flying-type move with 60 power and 100% accuracy. It is a straightforward and reliable attack that deals damage with no additional effects. Wing Attack is accessible to many Flying-type Pokémon and offers a solid option for consistent damage output. It's often used in the early to mid-game stages due to its balance of power and precision. Wing Attack has been a staple in Pokémon games since Generation I, making it a familiar move for veteran players."
move,whirlwind,"**Whirlwind** is a Normal-type move with no power and no accuracy in the conventional sense, as it does not deal damage. Instead, Whirlwind forces the target to switch out with another Pokémon in its party chosen at random in trainer battles. In wild battles, it causes the opposing Pokémon to flee. Whirlwind always goes last regardless of the user's Speed, having a priority of -6. It can bypass Substitute and certain abilities that prevent switching, like Suction Cups, but it is ineffective against Pokémon with the ability Soundproof. Whirlwind is often used strategically to disrupt the opponent's setup or to accumulate damage through entry hazards."
move,fly,"**Fly** is a Flying-type move with 90 power and 95% accuracy. This two-turn move allows the user to fly up high during the first turn, making it untargetable by most moves, and then strike on the second turn. Fly is often used not only for its solid power but also for its utility in avoiding damage for a turn. Outside of battle, Fly is a convenient HM (Hidden Machine) move that lets players fast-travel to previously visited locations. In competitive play, while it provides a tactical advantage, it is less commonly used due to the predictability during its charge turn."
move,bind,"**Bind** is a Normal-type move with 15 power and 85% accuracy. This move traps the target and inflicts damage over a period of 4-5 turns. During this time, the target is unable to switch out and takes additional damage at the end of each turn, which is typically 1/8 of its maximum HP. Bind's functionality makes it useful for wearing down opponents and preventing them from switching to a more favorable matchup. However, due to its low power and accuracy, it is not commonly used in competitive play but can be strategically significant in certain situations."
move,slam,"**Slam** is a Normal-type move with 80 power and 75% accuracy. Despite its relatively high power, it is often considered less reliable due to its lower accuracy compared to other moves. Slam does not have any additional effects such as causing status conditions or altering stats. It is a physical move, making it most effective when used by Pokémon with high Attack stats. Slam is one of the older moves in the Pokémon series, introduced in the first generation of games. It is typically associated with large, physically powerful Pokémon."
move,vine-whip,"**Vine Whip** is a Grass-type move with 45 power and 100% accuracy. It is one of the earliest Grass-type moves that Pokémon can learn, making it a staple for many beginner trainers. Vine Whip uses fast, whip-like vines to strike the opponent. Despite its relatively low power, it is useful in the early stages of the game for Grass-type Pokémon and is often seen in various Pokémon media, including the anime where it is depicted in several notable battles."
move,stomp,"**Stomp** is a Normal-type move with 65 power and 100% accuracy. It has a 30% chance of causing the target to flinch, which prevents the target from acting on that turn. Stomp is notable for its higher flinch rate compared to many other moves, making it useful for disruption strategies. Additionally, when used against a target that has used the move Minimize, Stomp's power is doubled, making it particularly effective against evasion-based tactics. This move has been a staple in various Pokémon games and is often used by Pokémon with a physical attack focus."
move,double-kick,"**Double-Kick** is a Fighting-type move with 30 power and 100% accuracy. This move hits the target twice in a single turn, effectively doubling its total power to 60 if both hits land. Each hit is calculated separately for accuracy and critical hits, which can be advantageous against opponents using moves or abilities that activate based on single hits. Double-Kick is often used to break through Substitute or break the effects of Sturdy and Focus Sash, making it a strategic choice in battle."
move,mega-kick,"**Mega Kick** is a Normal-type move with 120 power and 75% accuracy. It does not have any additional effects besides dealing damage. Mega Kick is one of the most powerful Normal-type moves in terms of raw damage, but its lower accuracy makes it a risky option compared to other moves. Due to its high power, it's often seen as a high-risk, high-reward move and is typically taught to Pokémon via TM01. Players may choose Mega Kick for its sheer damage potential when they are willing to gamble on its lower hit rate or when they intend to make a big impact within a short engagement. Mega Kick has been present in the Pokémon series since Generation I and remains a signature powerful attack for many Pokémon that can learn it."
move,jump-kick,"**Jump Kick** is a Fighting-type move with 100 power and 95% accuracy. If Jump Kick misses or the user is hit during the turn, the user takes crash damage equal to half of the damage it would have dealt. This move is commonly used by various Fighting-type Pokémon and is favored for its high power, making it a strong option in battles. However, its drawback of causing significant recoil damage on a miss requires careful consideration and strategic use."
move,rolling-kick,"**Rolling Kick** is a Fighting-type move with 60 power and 85% accuracy. It has a 30% chance of causing the target to flinch, making it unable to attack on the next turn. This move is advantageous for disrupting the opponent's strategy. Rolling Kick is notable for being one of Hitmonlee's signature moves in the earlier generations of Pokémon games. While not the most powerful Fighting-type move, its potential to cause flinching can make it a valuable strategic option in battles."
move,sand-attack,"**Sand-Attack** is a Ground-type move with no direct power and 100% accuracy. Instead of dealing damage, Sand-Attack lowers the target's accuracy by one stage, making it more likely for the opponent’s moves to miss. This makes Sand-Attack a strategic move often used to hinder opponents and gain an upper hand in battle. Despite its simplicity, it can be pivotal in prolonged battles where landing hits is crucial. Sand-Attack is commonly found on many early-game Pokémon, especially those that are Ground-type or live in desert environments."
move,headbutt,"**Headbutt** is a Normal-type move with 70 power and 100% accuracy. Introduced in Generation I, Headbutt has a notable 30% chance of causing the target to flinch if the user attacks first. It can be taught to a variety of Pokémon through TM02 (in certain games) and is also commonly learned by Pokémon that naturally feature head or ramming tactics. Beyond its battle utility, Headbutt is unique for its out-of-battle function in Generation II and Pokémon HeartGold and SoulSilver, where it allows players to knock on trees to encounter wild Pokémon or items. Its balanced combination of power, accuracy, and secondary effects makes it a versatile move in both battle and exploration contexts."
move,horn-attack,"**Horn Attack** is a Normal-type move with 65 power and 100% accuracy. This move simply involves a sharp horn attack against the opponent. It has no secondary effects, making it a straightforward physical attack. Horn Attack is one of the classic moves, first introduced in Generation I of Pokémon games. It is typically used by horned Pokémon, such as Tauros and Rhyhorn, and while it lacks additional effects like causing status conditions or stat changes, its reliable accuracy and decent power make it a solid choice for straightforward physical damage."
move,fury-attack,"**Fury Attack** is a Normal-type move with variable power. It has an accuracy of 85% and hits the target 2 to 5 times per use. Each individual hit has a base power of 15. This means the total power can range from 30 to 75, depending on the number of hits landed. Fury Attack is a multi-strike move that can break through substitutes and is useful against targets with sturdy abilities or those that have used focus sash. Although its power and accuracy are not particularly high, it's often used for its ability to deal multiple hits in one turn."
move,horn-drill,"**Horn Drill** is a Normal-type move with 1 power and an accuracy of 30%. It is a one-hit knockout (OHKO) move, meaning if it successfully hits, it will instantly faint the target regardless of their remaining HP. However, it cannot affect targets of a higher level than the user. Horn Drill is often considered a high-risk, high-reward move due to its low accuracy but potential to change the course of a battle by knocking out an opponent with a single hit. Like other OHKO moves, its effectiveness is further restricted by battle mechanics that prevent it from working on opponents with the Sturdy ability or those that have used moves like Protect."
move,tackle,"**Tackle** is a Normal-type move with 40 power and 100% accuracy. It is one of the most basic and well-known moves in Pokémon, often learned by many Pokémon at a low level. Tackle deals physical damage with no additional effects. While its power is relatively low compared to other moves, its perfect accuracy makes it reliable in early battles. Over the various generations, Tackle has gone through some modifications in power, originally starting at 35 before being increased to 50, and then being adjusted back to 40."
move,body-slam,"**Body Slam** is a Normal-type move with 85 power and 100% accuracy. It has a 30% chance of paralyzing the target. Body Slam is notable for its combination of reliable power and high chance to inflict paralysis, making it a versatile move in both casual and competitive play. Additionally, because it is a Normal-type move, it benefits from the Same Type Attack Bonus (STAB) when used by Normal-type Pokémon, further increasing its effectiveness. Body Slam can also be used by a wide variety of Pokémon, adding to its popularity and strategic value in battles."
move,wrap,"**Wrap** is a Normal-type move with 15 power and 90% accuracy. It inflicts damage and binds the target for 4-5 turns, preventing them from fleeing or switching out. During this binding period, the target takes 1/8 of their maximum HP as damage at the end of each turn. In later generations, the damage over time effect is reduced to 1/16 of the target's maximum HP each turn. Wrap is notable for its utility in trapping opponents, making it a strategic option for setting up other moves or waiting out turns in a battle."
move,take-down,"**Take-Down** is a Normal-type move with 90 power and 85% accuracy. This move causes the user to receive recoil damage, which is calculated as 25% of the damage dealt to the opponent. While Take-Down boasts considerable power, its relatively lower accuracy and the recoil damage make it a riskier choice compared to other Normal-type moves. It is often used when a trainer seeks a strong attack but is willing to risk some self-inflicted damage. Additionally, it has no secondary effects other than recoil. Due to its drawbacks, Take-Down is less commonly used in competitive play, where consistency and minimizing self-damage are often prioritized."
move,thrash,"**Thrash** is a Normal-type move with 120 power and 100% accuracy. Thrash causes the user to attack for 2 to 3 consecutive turns, during which the user cannot switch out or use any other move. After this sequence of attacks, the user becomes confused. Thrash is known for its high base power but comes with the drawback of potentially leaving the user vulnerable due to confusion. It is often used by Pokémon with high Attack stats to maximize damage output, but players should be cautious of the confusion effect that follows the thrashing turns."
move,double-edge,"**Double-Edge** is a Normal-type move with 120 power and 100% accuracy. It deals significant damage but causes the user to take recoil damage equal to one-third of the damage dealt to the target. Double-Edge is known for its high-risk, high-reward nature, often used by Pokémon with high attack stats to maximize damage output. Despite the drawback of recoil damage, it remains a popular choice for robust physical attackers who can handle the loss of HP or have abilities (like Rock Head) that negate recoil effects. Double-Edge has been a staple in numerous Pokémon move sets across generations due to its raw power and reliable accuracy."
move,tail-whip,"**Tail Whip** is a Normal-type move with no power and 100% accuracy. Rather than dealing damage, Tail Whip lowers the Defense stat of all opposing Pokémon by one stage. This can make it easier for subsequent attacks from the user's team to deal more damage. Tail Whip is often learned at early levels by many Pokémon and is particularly useful in the early stages of battles or training. It has been a staple move since the first generation of Pokémon games, making it a familiar tactic for lowering an opponent's defenses in preparation for stronger attacks."
move,poison-sting,"**Poison Sting** is a Poison-type move with 15 power and 100% accuracy. It has a 30% chance of poisoning the target, inflicting damage over time through the Poison status condition. Poison Sting is one of the earliest Poison-type moves available to many Pokémon, often utilized in the early stages of the game. While its base power is relatively low, its potential to poison the opponent makes it a valuable tool in certain strategies, especially in battles where wearing down the enemy over time is advantageous."
move,twineedle,"**Twineedle** is a Bug-type move with 25 power and 100% accuracy. It hits the target twice in one turn, which provides a higher chance to break through substitutes or focus sashes. Each hit has a 20% chance to poison the target, making it one of the few Bug-type moves that can inflict a status condition. Twineedle is one of the signature moves of Beedrill, utilizing its double stingers. Despite its lower base power, the move's unique ability to hit twice and potential to poison makes it a valuable addition to certain strategies in both casual and competitive play."
move,pin-missile,"**Pin Missile** is a Bug-type multi-strike move with 25 power per hit and 95% accuracy. It strikes the target 2 to 5 times in one turn, with each hit having its own chance to critically hit. Introduced in Generation I, Pin Missile has been a staple move for various Bug-type Pokémon. The odds of hitting 2, 3, 4, or 5 times are 37.5%, 37.5%, 12.5%, and 12.5% respectively. This move can break Substitute and is affected by the abilities Skill Link, which guarantees 5 hits, and Mega Launcher, which does not affect it. Its high variability in damage makes it both a strategic and occasionally unpredictable choice in battle."
move,leer,"**Leer** is a Normal-type move with no power and 100% accuracy. It lowers the Defense stat of all adjacent opponents by one stage. Leer can be useful in battle to weaken the defenses of foes, making them more susceptible to physical attacks. It is often learned by Pokémon at early levels and can be a strategic move in the early stages of a battle to pave the way for stronger offensive maneuvers."
move,bite,"**Bite** is a Dark-type move with 60 power and 100% accuracy. It has a 30% chance of causing the target to flinch, preventing them from attacking during that turn. Bite is a physical attack, making it effective for Pokémon with high Attack stats. It is a move that has been around since the first generation of Pokémon games and is commonly used for its reliable damage and the added strategic benefit of potentially flinching opponents. Bite is effective against Psychic- and Ghost-type Pokémon, adding to its utility in various battles."
