resource,name,summary
move,clanging-scales,"**Clanging Scales** is a Dragon-type move with 110 power and 100% accuracy. It was introduced in Generation VII and is the signature move of Kommo-o. When used, Clanging Scales deals heavy damage to the opponent but lowers the user's Defense stat by one stage after the attack. The move is notable for its high power and guaranteed accuracy, making it a formidable option in battle. The sound-based nature of Clanging Scales means it can hit through abilities like Substitute, which typically nullify other moves. This move is a double-edged sword, offering significant damage at the cost of reduced durability for the user."
move,dragon-hammer,"**Dragon Hammer** is a Dragon-type move with 90 power and 100% accuracy. Introduced in Generation VII, it is the signature move of Alolan Exeggutor. Dragon Hammer delivers a powerful physical attack with no additional effects or secondary conditions. This move allows Alolan Exeggutor to capitalize on its Dragon typing and relatively high Attack stat, making it a formidable option in battles. Despite its straightforward nature, Dragon Hammer is notable for embodying Alolan Exeggutor's unique design and thematic elements."
move,brutal-swing,"**Brutal Swing** is a Dark-type move with 60 power and 100% accuracy. It is a physical attack that targets all adjacent Pokémon, making it useful in Double and Multi Battles. Brutal Swing has no additional effects beyond its base damage, but its ability to hit multiple targets can provide strategic advantages in specific battle situations. Introduced in Generation VII, it allows players to deal with opponents' multiple Pokémon at once, adding a layer of strategy to its use."
move,aurora-veil,"**Aurora Veil** is an Ice-type status move with no power and no accuracy requirement as it always hits when used under the right conditions. This move can only be used when hail is active and halves the damage taken from both physical and special attacks for five turns by the user’s team. Aurora Veil is particularly valuable in competitive play for its damage-mitigation properties, making it difficult for opponents to knock out the user's Pokémon. Common users include Alolan Ninetales, which can also set up hail with its Snow Warning ability, and Abomasnow."
move,sinister-arrow-raid,"**Sinister Arrow Raid** is a Ghost-type Z-Move with 180 power and perfect accuracy, meaning it never misses. It is the signature Z-Move of Decidueye and can only be used if the Pokémon is holding a Decidium Z and knows the move Spirit Shackle. When executed, Decidueye surrounds the target with a swarm of spectral arrows, dealing massive damage. Sinister Arrow Raid is known for its cinematic and dramatic animation, making it a standout Z-Move in the Pokémon series. It's especially notable for its power and guaranteed accuracy, making it a reliable choice in battle scenarios."
move,malicious-moonsault,"**Malicious Moonsault** is a Dark-type Z-Move with 180 power and 101% accuracy. This move is the exclusive Z-Move of Incineroar, activated by using the Incinium Z. Malicious Moonsault has a unique animation where Incineroar performs a high-flying wrestling attack. As a Z-Move, it bypasses traditional accuracy checks and is guaranteed to hit its target unless the target is invulnerable. It also benefits from Incineroar's high Attack stat, making it a formidable option in competitive play to deliver a powerful blow, particularly to Psychic- and Ghost-type opponents."
move,oceanic-operetta,"**Oceanic Operetta** is a Water-type Z-Move with a base power of 195. It is the special Z-Move exclusive to Primarina, the final evolution of Popplio, when it holds a Primarium Z. The move is activated through the use of Primarina's Sparkling Aria. Oceanic Operetta showcases a powerful, visually striking performance where Primarina unleashes a massive water attack. Unlike other moves, being a Z-Move, it does not miss and thus has perfect accuracy. As a signature Z-Move, it can only be used once per battle, making it a strategic choice in both casual and competitive play for delivering a potentially game-changing blow."
move,guardian-of-alola,"**Guardian of Alola** is a Z-Move of the Fairy type used by the guardian deities of the Alola region (Tapu Koko, Tapu Lele, Tapu Bulu, and Tapu Fini). This move does not have a fixed power but instead reduces the target's HP by 75% of its current HP, making it particularly effective against bulkier opponents. Since it is a Z-Move, its accuracy is guaranteed, provided the status conditions of the move's prerequisites are met. Guardian of Alola can only be executed if the Pokémon is holding a Tapunium Z and knows the move Nature's Madness. This move is unique to the guardian deities and showcases their immense protective power over the Alola region."
move,soul-stealing-7-star-strike,"**Soul-Stealing 7-Star Strike** is a Ghost-type Z-Move with a base power variable depending on the move it is derived from but typically very high. It is performed by Dusk Mane Necrozma, or any other Pokémon that knows the move ""Spectral Thief"" and is holding the Decidium Z crystal. This powerful move never misses when executed, ensuring 100% accuracy. Not only does it deliver significant damage, but it also represents one of the signature moves of the Pokémon Marshadow. This move is both visually spectacular and highly effective, often turning the tide in competitive battles due to its sheer power and guaranteed hit."
move,stoked-sparksurfer,"**Stoked-Sparksurfer** is an Electric-type Z-Move with 175 power and has perfect accuracy. Unique to Alolan Raichu when it is holding an Aloraichium Z, this move is transformed from Thunderbolt. When using Stoked-Sparksurfer, the user surfs on its tail to attack, and it brings an advantageous secondary effect: it always results in the opponent getting paralyzed. This move is visually distinct and emphasizes Alolan Raichu's unique characteristics, making it a strategic choice in battles to inflict status ailments while delivering significant damage."
move,pulverizing-pancake,"**Pulverizing-Pancake** is a Normal-type Z-Move with a base power of 210. It always hits its target, so it has 100% accuracy by default. Pulverizing-Pancake is exclusive to Alolan Raichu, which can only use this move when holding an Aloraichium Z and has the move Thunderbolt in its arsenal. This move showcases Alolan Raichu’s unique characteristics and emphasizes the flavor of unleashing a powerful attack by combining its Electric type with the Normal-type Z-Move mechanic. The animation for Pulverizing-Pancake is particularly memorable, featuring Alolan Raichu using psychic powers to perform an acrobatic flip before crashing down on the opponent."
move,extreme-evoboost,"**Extreme Evoboost** is a Normal-type Z-Move with no power or accuracy rating as it is a status move. When used, it boosts the user's Attack, Defense, Special Attack, Special Defense, and Speed by two stages each. To activate Extreme Evoboost, the Pokémon must know the move ""Celebrate"" and be holding the Eevium Z-Crystal. This move is exclusive to Eevee and capitalizes on its potential, making it a highly strategic option in battle to drastically enhance its stats and become a formidable opponent."
move,genesis-supernova,"**Genesis Supernova** is a Psychic-type move with 185 power and 100% accuracy. This special move was introduced in Generation VII and is exclusive to Mew when it is holding the Mewnium Z and uses the Z-Move upgrade of its move Psychic. Aside from dealing massive damage, Genesis Supernova also creates a Psychic Terrain for five turns, which boosts the power of Psychic-type moves by 50% and prevents priority moves from being used. This makes it not only a powerful offensive option but also a strategic move for controlling the battle environment."
move,shell-trap,"**Shell-Trap** is a Fire-type move with 150 power and 100% accuracy. This move can only be used by the Pokémon Turtonator. Shell-Trap sets a trap at the beginning of the turn, and if Turtonator is hit by a physical move during that turn, the trap will explode, dealing massive damage to the attacker. It’s unique because it requires strategic planning, as the move will fail if Turtonator is not struck by a physical attack. This makes Shell-Trap an intriguing choice for players who enjoy prediction-based playstyles and want to use Turtonator's defensive capabilities to their advantage."
move,fleur-cannon,"**Fleur Cannon** is a Fairy-type move with 130 power and 90% accuracy. It is the signature move of the Pokémon Magearna. Fleur Cannon is exceptionally powerful but comes with a drawback: after using the move, the user's Special Attack stat decreases by two stages. This trade-off makes it a high-risk, high-reward option in battle. It is commonly utilized for its sheer power to deal substantial damage, but trainers must be mindful of the subsequent decrease in offensive capability. Fleur Cannon's distinctive attribute makes it a strategic choice for players who can effectively manage its downside."
move,psychic-fangs,"**Psychic Fangs** is a Psychic-type move with 85 power and 100% accuracy. It not only deals damage but also destroys any barriers like Light Screen and Reflect on the target's side of the field. This move is particularly useful for breaking through defensive setups and ensuring that more damage is dealt in the subsequent turns. Psychic Fangs is commonly used by Pokemon with strong physical attack stats that can benefit from its secondary effect, such as Arcanine and Rapidash. Its dual functionality of dealing damage and removing barriers makes it a strategic choice in both casual and competitive battles."
move,stomping-tantrum,"**Stomping Tantrum** is a Ground-type move with 75 power and 100% accuracy. If the user's previous move failed, Stomping Tantrum's power doubles to 150. This move can be a strategic choice, punishing the opponent if they manage to protect or cause the user to miss its attack. Stomping Tantrum does not have any additional effects such as causing status conditions but is notable for its potential to turn the tide of battle with its doubled power condition."
move,shadow-bone,"**Shadow Bone** is a Ghost-type move with 85 power and 100% accuracy. Introduced in Pokémon Sun and Moon, it is exclusive to Alolan Marowak. Shadow Bone has a 20% chance of lowering the target's Defense by one stage. This move highlights Alolan Marowak's role as a physical attacker and enhances its utility in battles by potentially weakening opponents' defenses. Shadow Bone's combination of reliable accuracy, decent power, and the chance to decrease Defense makes it a notable move for Alolan Marowak in both casual and competitive play."
move,accelerock,"**Accelerock** is a Rock-type move with 40 power and 100% accuracy. It is a physical attack known for its priority status, meaning it will almost always go first in battle regardless of the user's speed, unless the opponent is using an even higher priority move. Accelerock is the signature move of Lycanroc in its Midday and Dusk forms, highlighting its association with these Pokémon. This move is particularly useful for quickly finishing off faster opponents or delivering a crucial hit before the opponent can react. Despite its relatively low base power, the priority aspect of Accelerock makes it a valuable strategic tool in battles."
move,liquidation,"**Liquidation** is a Water-type move with 85 power and 100% accuracy. It has a 20% chance of lowering the target's Defense by one stage. Introduced in Generation VII, Liquidation is often favored for its solid power and the useful secondary effect of potentially reducing the opponent's Defense, making it easier to deal more damage in subsequent turns. This move is particularly effective on physical Water-type attackers and can be found in the move pools of various aquatic Pokémon. Its combination of reliability and utility makes it a popular choice in both competitive and casual play."
move,prismatic-laser,"**Prismatic Laser** is a Psychic-type move with 160 power and 100% accuracy. This high-damage move requires the user to recharge on the next turn, rendering them unable to take any actions during that time. Prismatic Laser is the signature move of the Pokémon Necrozma and is notable for its vibrant, colorful animation in battle. Due to its immense power and the recharge requirement, Prismatic Laser is often used as a finishing move or when a player is confident they can manage the turn of vulnerability that follows."
move,spectral-thief,"**Spectral Thief** is a Ghost-type move with 90 power and 100% accuracy. This unique move not only deals damage but also steals any stat boosts that the target has accumulated, adding them to the user's own stats. Spectral Thief ignores the need for an intermediary setup move, making it a strategic choice to counter opponents relying on stat boosts. Introduced in Generation VII, it is the signature move of Marshadow, enhancing its utility in both offensive and defensive scenarios. The combination of reliable accuracy, solid power, and the additional effect of stealing stat boosts makes Spectral Thief a highly valuable move in competitive battling."
move,sunsteel-strike,"**Sunsteel Strike** is a Steel-type move with 100 power and 100% accuracy. Notably, it ignores the target's ability when dealing damage, which can bypass abilities that would normally reduce or negate the impact of attacks. Sunsteel Strike is a signature move of the Legendary Pokémon Solgaleo, reflecting its mythically powerful and radiant attributes. This move is highly valued in competitive play for its ability to consistently deliver strong, reliable damage while countering defensive abilities such as Sturdy or Multiscale. Its unique combination of high power, perfect accuracy, and ability-negating property makes it a formidable option in battle."
move,moongeist-beam,"**Moongeist Beam** is a Ghost-type move with 100 power and 100% accuracy. Introduced in Pokémon Sun and Moon, it is the signature move of the Legendary Pokémon Lunala. Moongeist Beam is notable for ignoring the target's abilities during damage calculation, allowing it to bypass abilities that would typically negate or reduce damage, such as Sturdy, Multiscale, and Wonder Guard. This makes it particularly effective against targets that rely on such abilities for survival. The move's combination of high power and ability-negating effects make it a formidable choice in competitive battles."
move,tearful-look,"**Tearful Look** is a Normal-type move with no power and perfect accuracy. This move causes the target to become emotionally affected, lowering its Attack and Special Attack stats by one stage each. Tearful Look does not cause any direct damage but is useful for weakening opponents and making them less effective in battle. It's often used strategically to reduce the threat posed by high-damage-dealing Pokémon. The move operates independently of the user's stats, making it a reliable debuffing option in various scenarios."
move,zing-zap,"**Zing-Zap** is an Electric-type move with 80 power and 100% accuracy. It has the added effect of causing the target to flinch 30% of the time, making it useful for disrupting opponents' strategies. Zing-Zap is the signature move of the Pokémon Togedemaru, introduced in Generation VII, and takes advantage of Togedemaru’s ability to utilize physical Electric-type moves effectively. The move's combination of reliable accuracy and a chance to flinch makes it a valuable tool in various battle scenarios."
move,natures-madness,"**Nature's Madness** is a Fairy-type move with no set power but always reduces the target's current HP by 50%. It has 90% accuracy. Nature's Madness does not consider the target's defense or special defense stats, making it particularly useful against bulky opponents. It is signature to the Guardian Deities of the Alola region (Tapu Koko, Tapu Lele, Tapu Bulu, and Tapu Fini), contributing to their unique roles in both casual and competitive play. Despite dealing no direct damage, its ability to halve the opponent’s HP makes it a strategic option for weakening foes significantly."
move,multi-attack,"**Multi-Attack** is a Normal-type move with 120 power and 100% accuracy, making it a highly reliable and potent attack. This move is unique to the Pokémon Silvally and is notable for its ability to change type depending on the Memory item that Silvally is holding. The Memory items correspond to different Pokémon types, effectively allowing Multi-Attack to become any type in the game except for Normal when no Memory is held. This adaptability makes Silvally a versatile threat in various battles, capable of tailoring its offensive strategy to counter a wide array of opponents. Multi-Attack's ability to shift its typing is a distinctive characteristic and one of the features that makes Silvally stand out in both casual and competitive play."
move,10-000-000-volt-thunderbolt,"**10,000,000 Volt Thunderbolt** is an Electric-type Z-Move with a base power of 195. As a Z-Move, it always hits its target, bypassing accuracy checks. This move can only be used by a Pokémon holding a compatible Z-Crystal, specifically Pikashunium Z, and requires the move Thunderbolt in its move set. It is known for its signature animation featuring Pikachu surrounded by an enormous electric aura. Introduced in Pokémon Sun and Moon, it highlights the unique bond between Pikachu and its trainer. This move is typically seen in special battle formats where Z-Moves are allowed, showcasing Pikachu's potential to deal significant damage in a single powerful strike."
move,mind-blown,"**Mind-Blown** is a Fire-type move with a high power of 150 and 100% accuracy. This powerful move is unique to Blacephalon, a Pokémon introduced in Generation VII. While its sheer power makes it exceptionally strong, it has a notable drawback: it inflicts damage equal to 50% of the user's maximum HP. This self-damaging aspect requires strategic use, as it significantly impacts Blacephalon's staying power in battle. Despite the recoil, Mind-Blown's immense power makes it a formidable option for dealing heavy damage, especially against opponents vulnerable to Fire-type moves."
move,plasma-fists,"**Plasma Fists** is an Electric-type move with 100 power and 100% accuracy. This signature move of the Mythical Pokémon Zeraora transforms all Normal-type moves into Electric-type moves for the duration of the turn it is used. Besides its impressive power and accuracy, Plasma Fists' unique effect can be strategically used to disrupt opponents relying on Normal-type moves and to boost the effectiveness of Electric-type strategies. Its combination of raw power and tactical utility makes it a standout move in Zeraora's arsenal."
move,photon-geyser,"**Photon Geyser** is a Psychic-type move with 100 power and 100% accuracy. This move is unique because it determines whether to use the user’s Attack or Special Attack stat to deal damage, depending on which is higher, effectively optimizing its damage output. Photon Geyser is exclusive to the Pokémon Necrozma and its various forms. Additionally, when Necrozma transforms into its Ultra form using Ultra Burst, Photon Geyser becomes extremely powerful due to the stat boost it receives."
move,light-that-burns-the-sky,"**Light-That-Burns-The-Sky** is a Psychic-type Z-Move introduced in Pokémon Ultra Sun and Ultra Moon. It has a base power of 200 and is known for its high damage potential. This move never misses, effectively giving it 100% accuracy. Light-That-Burns-The-Sky can only be used by Ultra Necrozma, a form that Necrozma can take after using the item Ultranecrozium Z. The move is notable for bypassing abilities that would otherwise reduce the damage or mitigate the effects of moves, such as Disguise or Multiscale. Additionally, it gets a power boost if Ultra Necrozma has a stat boost, making it a formidable attack in the right conditions."
move,searing-sunraze-smash,"**Searing-Sunraze Smash** is a Steel-type Z-Move with variable power that depends on the base move it's derived from, typically reaching 200 or higher. It is performed by Solgaleo or a Pokémon transformed into Solgaleo while holding the exclusive Z-Crystal, Solganium Z. This move bypasses the usual accuracy checks, ensuring it always hits unless the opponent is using a semi-invulnerable move like Dig or Fly. Searing-Sunraze Smash combines the ferocity of an intense physical attack with a spectacular visual display, making it a signature move that emphasizes Solgaleo's connection to the sun."
move,menacing-moonraze-maelstrom,"**Menacing Moonraze Maelstrom** is a Ghost-type Z-Move with a base power of 200. It is exclusive to Dawn Wings Necrozma and Lunala if they are holding the appropriate Z-Crystal, known as Lunalium Z. This move does not have a standard accuracy rating since Z-Moves, in general, are guaranteed to hit unless the target is using a semi-invulnerable move like Dig or Fly. Menacing Moonraze Maelstrom is derived from the move Moongeist Beam and ignores the target's Ability, including those that would normally grant immunity to Ghost-type moves, such as Normal-type Pokémon with the ability Levitate. This move provides a unique strategic advantage in battles, as it allows powerful Ghost-type damage bypassing potential hindrances from the opponent's abilities."
move,lets-snuggle-forever,"**Let's Snuggle Forever** is a Fairy-type Z-Move with 190 base power and no accuracy check, as it always hits if the base move does. It is the exclusive Z-Move of Mimikyu and is performed by upgrading its Play Rough move using a Mimikium Z. This move is known for its high power and is animated with Mimikyu jumping towards the target in a cute yet fiercely determined manner. Being a Z-Move, it can only be used once per battle and requires the corresponding Z-Crystal and move to be set up properly, making it a potent and strategic option in competitive play."
move,splintered-stormshards,"**Splintered Stormshards** is a Rock-type Z-move introduced in Pokémon Ultra Sun and Ultra Moon. It is a special move with base power tied to the user's Attack or Special Attack stat, depending on which move it is powered by. Its accuracy is guaranteed when executed. One of the unique aspects of Splintered Stormshards is that, in addition to dealing significant damage, it can remove any active terrain effects on the battlefield. This move is exclusive to the Pokémon Lycanroc when it is holding a specific Z-Crystal called Lycanium Z."
move,clangorous-soulblaze,"**Clangorous Soulblaze** is a Dragon-type Z-Move introduced in Pokémon Ultra Sun and Ultra Moon. It has a base power of 185 and is always accurate, never missing its target. This move can only be used when Kommo-o is holding the Kommonium Z and knows the move Clanging Scales. When executed, Clangorous Soulblaze not only deals damage to all adjacent opponents in battles but also raises all of Kommo-o's stats (Attack, Defense, Special Attack, Special Defense, and Speed) by one stage each. This powerful and unique effect makes Clangorous Soulblaze a highly strategic move, providing both offensive power and significant stat boosts."
move,zippy-zap,"**Zippy-Zap** is an Electric-type move with 50 power and 100% accuracy. It has a priority level of +2, meaning it usually goes before other moves regardless of the user's speed. Zippy-Zap also guarantees a critical hit, effectively giving it a power boost and ignoring the target's stat changes. This move is exclusive to the Pikachu partner from the Pokémon: Let's Go, Pikachu! game, making it unique to that title and character. The move's combination of priority and guaranteed critical hit makes it an effective tool for dealing with faster or heavily defensive opponents."
move,splishy-splash,"**Splishy-Splash** is a Water-type move with 90 power and 100% accuracy. It has a 30% chance of causing the target to flinch, which can disrupt the opponent's strategy by preventing their Pokémon from moving that turn. This move is exclusive to the game ""Pokémon Let's Go, Pikachu! & Let's Go, Eevee!"", where it is uniquely available to Pikachu when it learns special partner moves. Despite being a Water-type move, its availability to Pikachu adds an interesting dynamic to the gameplay, allowing this Electric-type Pokémon to cover more types, such as Fire, Ground, and Rock, which would ordinarily be problematic."
move,floaty-fall,"**Floaty Fall** is a Flying-type move with 90 power and 95% accuracy. It also has a 30% chance of causing the target to flinch. Floaty Fall is a unique move exclusive to Pikachu in ""Pokémon: Let's Go, Pikachu!"" It’s designed to capitalize on Pikachu's popularity, featuring an animation where Pikachu uses a balloon to float up before crashing down on the opponent. This move combines decent power and a useful secondary effect, making it a versatile option in battles."
move,pika-papow,"**Pika-Papow** is an Electric-type move used exclusively by the partner Pikachu in Pokémon: Let's Go, Pikachu! While it has indefinite power, its strength increases with the Pikachu's bond to its Trainer, making it a potentially very strong move. Pika-Papow always hits the target, ensuring 100% accuracy. This move emphasizes the unique connection between the player and their partner Pokémon, showcasing their friendship and cooperation in battle."
