resource,name,summary
move,frustration,"**Frustration** is a Normal-type move with variable power that ranges from 1 to 102. Its accuracy is 100%. The move's power is inversely related to the user's happiness or friendship level; the lower the Pokémon's friendship, the higher the move's power. Frustration is the counterpart to the move Return, which becomes stronger with higher friendship levels. This move is often strategically used in situations where a Pokémon's friendship is deliberately kept low, allowing it to hit with maximum strength. However, in modern competitive play, it is less commonly used due to the difficulty in maintaining low friendship levels."
move,safeguard,"**Safeguard** is a Normal-type status move with no power or accuracy attributes since it does not deal damage. When used, it creates a protective field around the user's team that prevents all status conditions (such as poison, paralysis, sleep, burn, and freeze) for five turns. Safeguard is particularly useful in both casual and competitive play to guard against status moves and conditions that could hinder a team's performance. It does not protect against the effects of status moves that do not inflict conditions (like Confuse Ray) and does not heal already present status effects."
move,pain-split,"**Pain Split** is a Normal-type move with no set power or accuracy percentage. Instead, it functions uniquely by averaging the current HP of the user and the target Pokémon, then setting both Pokémon's HP to this averaged amount. This move does not rely on accuracy checks like conventional damaging moves, making it bypass accuracy and evasion stats. Pain Split is particularly effective in scenarios where the user has significantly lower HP than its opponent, allowing for a substantial HP recovery for the user while reducing the opponent's HP. This move is commonly utilized in competitive play to maintain longevity, especially among Pokémon capable of tanking hits or those meant to disrupt an opponent's strategy."
move,sacred-fire,"**Sacred Fire** is a Fire-type move with 100 power and 95% accuracy. It has a notable 50% chance of burning the target, making it a powerful offensive and strategic option. Sacred Fire is the signature move of Ho-Oh, showcasing its mythical prowess. The burning effect can significantly cripple physical attackers by halving their attack power. This move is particularly revered in competitive play for its dual ability to deal significant damage and potentially inflict a status condition."
move,magnitude,"**Magnitude** is a Ground-type move with variable power that ranges between 10 and 150, depending on a randomly generated magnitude level from 1 to 10. It has 100% accuracy, meaning it never misses under normal conditions. Each magnitude level has different probabilities of occurring, with higher magnitudes being rarer. Magnitude is particularly intriguing because its power can vary wildly, making it a gamble in critical situations. It also affects all adjacent Pokémon in battle, which can be a double-edged sword in both double battles and horde encounters. Due to its variability, it is often favored in casual play for its potential high reward, despite the inherent risk."
move,dynamic-punch,"**Dynamic Punch** is a Fighting-type move with 100 power and 50% accuracy. Despite its low accuracy, it has the special effect of guaranteeing confusion on the target if it hits. This move is often used strategically to disrupt opponents, as the confusion status can cause them to hurt themselves in subsequent turns. Dynamic Punch is typically seen in competitive play with Pokémon that have the ability No Guard, which makes the move always hit, eliminating the drawback of its low accuracy."
move,megahorn,"**Megahorn** is a Bug-type move with 120 power and 85% accuracy. It is a physical attack and is one of the most powerful Bug-type moves available. Introduced in Generation II, Megahorn is often used by high-attack Pokémon such as Heracross. Despite its lower accuracy, the high damage output makes it a valuable asset in battles, especially for taking down opponents weak to Bug-type moves, such as Psychic, Dark, and Grass types. Megahorn does not have any added effects beyond its damage potential but is notable for its strength among Bug-type moves."
move,dragon-breath,"**Dragon Breath** is a Dragon-type move with 60 power and 100% accuracy. It has a 30% chance of paralyzing the target, making it a useful move for potentially debilitating opponents. Despite its relatively modest power compared to other Dragon-type moves, its high chance of causing paralysis can make it a strategic choice in battles. Dragon Breath is frequently used by Pokémon with strong Special Attack stats and can be particularly effective against other Dragon-type Pokémon due to its type advantage."
move,baton-pass,"**Baton Pass** is a Normal-type move with no power or accuracy rating because it does not inflict damage. Instead, Baton Pass allows the user to switch out of battle and transfer all its current stat changes, such as increases or decreases in Attack, Defense, Speed, etc., to the Pokémon that is switched in. This strategic move is highly valued in competitive play for teams that focus on setting up and sweeping, allowing one Pokémon to benefit from the stat boosts gained by another. However, players must be cautious as it also passes on any negative status effects the user might have."
move,encore,"**Encore** is a Normal-type status move with no power and 100% accuracy. When used, Encore forces the target to repeat its last used move for 3 turns. This can be strategically beneficial, especially if the opponent is locked into a non-damaging move or a move that is ineffective against the user. Encore has been a staple in competitive play for its ability to disrupt the opponent's strategy and create opportunities for the user to set up or switch to a more advantageous position."
move,pursuit,"**Pursuit** is a Dark-type move with 40 power and 100% accuracy. It has a unique effect where its power doubles to 80 if the target is switching out of battle. Pursuit is particularly useful for trapping and finishing off weakened opponents before they can escape. This mechanic makes it a valuable tool in competitive play, especially against Pokémon that rely on switching to evade attacks or status conditions."
move,rapid-spin,"**Rapid Spin** is a Normal-type move with 50 power and 100% accuracy. In addition to dealing damage, Rapid Spin removes certain effects on the user’s side of the field, such as binding moves (like Wrap and Fire Spin), Leech Seed, Spikes, Stealth Rock, and Toxic Spikes. Furthermore, starting from Generation VIII, Rapid Spin also increases the user’s Speed stat by one stage after use. Despite its relatively low power, Rapid Spin is highly valued in competitive play for its utility in clearing entry hazards and providing momentum with the Speed boost."
move,sweet-scent,"**Sweet Scent** is a Normal-type move with no power and perfect 100% accuracy. It does not deal direct damage but lowers the evasion of all adjacent opponents by two stages, making it easier for subsequent moves to hit them. Sweet Scent is often used in the wild to attract Pokémon, and it allows trainers to encounter Pokémon more easily by overriding moves like Fly and Dig when used in battle."
move,iron-tail,"**Iron Tail** is a Steel-type move with 100 power and 75% accuracy. It has a 30% chance of lowering the target's Defense by one stage. Iron Tail is a physical attack, meaning it relies on the user's Attack stat and the target's Defense stat. While its relatively low accuracy can be a drawback, its high power and the potential defensive debuff make it a valuable move for certain Pokémon, particularly those with strong physical stats and access to Steel-type moves. Iron Tail is notably associated with Pokémon like Pikachu and Steelix and can be used strategically to weaken the opponent's defenses for subsequent attacks."
move,metal-claw,"**Metal Claw** is a Steel-type move with 50 power and 95% accuracy. It has a 10% chance to increase the user's Attack stat by one stage when it hits the target. Metal Claw is often one of the earlier Steel-type moves that Pokémon learn, making it useful in the early to mid stages of battles. Despite its relatively low power, the potential to boost the user's Attack can make it a valuable asset in prolonged battles. First introduced in Generation II, it has since been a staple move for many Steel-type Pokémon, offering both offensive capability and the chance to enhance physical attacks further."
move,vital-throw,"**Vital Throw** is a Fighting-type move with 70 power and guaranteed accuracy, meaning it never misses its target. One of its unique characteristics is that it always makes the user move last in the turn, regardless of the user's Speed stat. This move ensures that it hits its mark every time, making it useful against evasive opponents. Vital Throw is especially notable for its reliability in situations where accuracy is crucial, despite its lower priority."
move,morning-sun,"**Morning Sun** is a Normal-type move with no power and perfect accuracy. Its primary function is to restore the user's HP, with the amount healed dependent on the weather conditions. Under normal weather, Morning Sun heals 50% of the user's maximum HP. In sunny weather, the healing increases to 66.7%, while in rain, hail, or sandstorm, the healing amount drops to 25%. Morning Sun is often used by Pokémon with the Ability Drought or in teams that utilize Sunny Day to maximize its healing potential. This move is especially popular in competitive play for stalling strategies and sustaining wall or tank Pokémon."
move,synthesis,"**Synthesis** is a Grass-type move with no power or accuracy value since it is a status move. It restores the user's HP by a variable amount depending on the weather conditions. Under normal weather, Synthesis heals 50% of the user's maximum HP. During sunny weather, it restores 66.7% of the user's maximum HP, and during other weather conditions (such as rain, hail, or sandstorm), it restores only 25% of the user's maximum HP. Synthesis is widely used by both defensive and supportive Pokémon due to its reliable healing capability."
move,moonlight,"**Moonlight** is a Fairy-type move that does not have a defined power or accuracy. Instead, it is a status move that heals the user. The amount of HP restored varies depending on the weather conditions: under normal conditions, Moonlight restores 50% of the user's maximum HP; during Sunny Day, it restores 2/3 (approximately 66.7%) of maximum HP; and during other weather conditions like Rain, Sandstorm, or Hail, it restores only 25% of maximum HP. Moonlight is particularly useful for Pokémon with good durability and is often chosen in competitive play for its reliable healing properties."
move,hidden-power,"**Hidden Power** is a unique move whose type and power are variable, depending on the user's Individual Values (IVs). It has a base power of 60 and 100% accuracy. Hidden Power can potentially be of any type (except Fairy in Generation VI onwards) and is often used strategically to cover weaknesses or exploit the opponent's vulnerability. Despite its fixed base power, its versatility makes it a valuable move in competitive play. Hidden Power was particularly notable before Generation VIII, as it provided many Pokémon with coverage moves they otherwise wouldn't have access to."
move,cross-chop,"**Cross Chop** is a Fighting-type move with 100 power and 80% accuracy. It has a high critical hit ratio, making it more likely to land a critical hit compared to standard moves. Introduced in Generation II, Cross Chop is notable for its significant damage potential, balanced by its relatively lower accuracy. This move is typically used by strong, physically-oriented Pokémon to maximize damage output, especially in scenarios where landing a critical hit could turn the tide of battle. However, the risk of missing makes it a less reliable option compared to other Fighting-type moves with higher accuracy."
move,twister,"**Twister** is a Dragon-type move with 40 power and 100% accuracy. It hits all adjacent opponents in double battles and has a 20% chance of causing each target to flinch. Twister also deals double damage to any opponent that is in the middle of using Fly or Bounce. While its base power may seem low, its ability to potentially disrupt opponents with flinching and its interaction with certain moves add strategic value. It is often seen on Pokémon that can exploit these additional effects in battle."
move,rain-dance,"**Rain Dance** is a Water-type status move with no power or accuracy value since it does not inflict damage directly. This move changes the weather condition to rain for five turns (or eight turns if the user holds a Damp Rock). During rain, the power of Water-type moves is increased by 50%, and the power of Fire-type moves is decreased by 50%. Additionally, certain abilities, like Swift Swim, Rain Dish, and Dry Skin, are activated or enhanced in rain, and moves like Thunder and Hurricane gain perfect accuracy. Rain Dance is a versatile move often used in weather-based strategies to boost Water-type attacks and support Pokémon with abilities or moves that benefit from rainy conditions."
move,sunny-day,"**Sunny Day** is a Fire-type status move with no power and infinite accuracy. When used, it changes the weather to sunny for five turns, which boosts the power of Fire-type moves by 50%, while reducing the power of Water-type moves by 50%. Additionally, certain abilities and moves are affected by the sunlight; for example, the ability Chlorophyll doubles the speed of Pokémon with this ability, and the move Solar Beam requires no charging turn. Sunny Day is commonly used to support teams that rely on Fire-type moves or Pokémon that benefit from sunny weather conditions."
move,crunch,"**Crunch** is a Dark-type move with 80 power and 100% accuracy. It has a 20% chance of lowering the target's Defense stat by one stage. Crunch is a physical move, making it an excellent choice for Pokémon with high Attack stats. It's also widely used for its additional effect of potentially reducing the target's defenses, making subsequent attacks more effective. Introduced in Generation II, Crunch has remained a popular and reliable move for many Dark-type and non-Dark-type Pokémon alike, offering both consistent damage and potential for strategic advantage in battles."
move,mirror-coat,"**Mirror Coat** is a Psychic-type move with variable power because it deals double the damage the user received from a special attack in the same turn. It has 100% accuracy but only works if the user is hit by a special attack. Mirror Coat does not consider the user's or the opponent's Special Defense when calculating damage, making it a strategic counter-attack move. It is particularly useful for Pokémon with high HP, allowing them to withstand strong special attacks and retaliate effectively. Mirror Coat can fail if the user moves first in the turn or if the opponent uses a physical move or status move. It is often taught to Pokémon like Wobbuffet, which can leverage its naturally high HP to maximize the move's impact."
move,psych-up,"**Psych-Up** is a Normal-type status move with no power and perfect accuracy. It allows the user to copy the target's current stat changes, including boosts and drops, making it a versatile move for evening the playing field in battles. Unlike many other moves, Psych-Up's effectiveness is not influenced by type advantages or resistances, as it solely affects the user's and target's stat modifications. It can be particularly useful in competitive play to counter opponents who rely on stat-boosting strategies. Psych-Up can also negate the negative effects of moves like Swagger or Flatter by turning the stat changes into potential advantages."
move,extreme-speed,"**Extreme-Speed** is a Normal-type move with 80 power and 100% accuracy. Unlike most other moves, Extreme-Speed has a priority of +2, allowing the user to often go first in battle, even before other priority moves with a lower priority bracket. This makes Extreme-Speed an excellent choice for finishing off weakened opponents or gaining a tactical advantage. The move is typically learned by a limited number of Pokémon, such as Dragonite, Arcanine, and certain event-exclusive Pokémon like Extreme-Speed Linoone. Extreme-Speed's combination of high priority and decent power makes it a valuable asset in both casual and competitive Pokémon battles."
move,ancient-power,"**Ancient Power** is a Rock-type move with 60 power and 100% accuracy. This special move has the unique effect of potentially raising all of the user's stats (Attack, Defense, Special Attack, Special Defense, and Speed) by one stage, with a 10% chance of triggering this boost. Ancient Power is notable for being one of the few moves that can enhance multiple stats simultaneously, making it a strategic choice for certain Pokémon, particularly those with balanced stat lines or the ability to capitalize on both offensive and defensive boosts. This move is also often associated with prehistoric or fossil Pokémon and is thematically suited for creatures with a connection to ancient times."
move,shadow-ball,"**Shadow Ball** is a Ghost-type move with 80 power and 100% accuracy. It has a 20% chance of lowering the target's Special Defense by one stage, making it a valuable move for both offensive and defensive strategies. Shadow Ball is widely used for its reliable damage output and the added benefit of potentially weakening the target's defenses. It's a staple move for many Ghost-type Pokémon and is also commonly taught to various other Pokémon via TMs and TRs in different generations. This move is particularly effective against Psychic- and Ghost-type Pokémon, making it a versatile choice in battles."
move,future-sight,"**Future Sight** is a Psychic-type move with 120 power and 100% accuracy. Unlike most moves, Future Sight takes two turns to deal damage: the initial turn it is used, and then it hits the target at the end of the next turn, bypassing any defensive moves the target may use within this timeframe. The delayed attack is not affected by the target's type effectiveness changes that may occur during the waiting period, making it very tactical. Future Sight also ignores Protect and Detect, and it takes into account the Special Attack and Special Defense stats at the time the damage is dealt. This move is typically used by Psychic-type Pokémon to apply strategic pressure on opponents, forcing them to anticipate and respond to the incoming damage."
move,rock-smash,"**Rock Smash** is a Fighting-type move with 40 power and 100% accuracy. It has a 50% chance of lowering the target's Defense by one stage. Despite its low base power, Rock Smash is frequently used outside of battles to break certain rocks in the overworld in various Pokémon games, revealing hidden items or opening new pathways. This move can be a useful utility in campaigns but is often replaced by stronger Fighting-type moves during competitive play."
move,whirlpool,"**Whirlpool** is a Water-type move with 35 power and 85% accuracy. It traps the target in a vortex for 4-5 turns, causing residual damage of 1/8 of the target's maximum HP at the end of each turn. Whirlpool is often used for its trapping ability, which prevents the target from escaping or switching out. This move is particularly useful in strategic battles to control the opponent's movements and wear down specific threats over time."
move,beat-up,"**Beat-Up** is a Dark-type move with variable power and 100% accuracy. The move's power is determined by the base Attack stats of all conscious Pokémon in the user's party, with each Pokémon contributing an individual hit. Each hit uses a base power of 10. Originally, in Generation II, Beat-Up calculated damage based on the user's Attack stat and base power of its allies, but it was later changed to consider the actual base Attack of each party Pokémon from Generation V onward. Unique among moves for potentially hitting the target multiple times in a single turn, Beat-Up is often used strategically to exploit matchups against Pokémon weak to Dark-type moves."
move,fake-out,"**Fake Out** is a Normal-type move with 40 power and 100% accuracy. This move has a unique property that allows it to always go first, provided it is used on the first turn the user is out. Fake Out causes flinching, making the target unable to act for that turn. This move is highly strategic in battles, particularly in Double Battles, as it can disrupt the opponent's initial strategy and provide an advantageous setup for the user's team. However, Fake Out can only be used once per appearance of the Pokémon, and its effectiveness diminishes if not used immediately after the Pokémon enters the battlefield."
move,uproar,"**Uproar** is a Normal-type move with 90 power and 100% accuracy. When Uproar is used, the user causes an uproar that lasts for 3 turns, preventing all Pokémon on the field from falling asleep. During this period, the user must continue using Uproar and cannot select another move. Uproar is useful for disrupting opponents who rely on sleep-inducing strategies and can be a solid choice for maintaining consistent damage output over several turns. Additionally, Pokémon with the ability Soundproof are immune to Uproar's effects."
move,stockpile,"**Stockpile** is a Normal-type status move with no power and perfect accuracy. It allows the user to store energy for up to three turns, raising its Defense and Special Defense stats by one stage each time it is used. Stockpile can be combined with two other moves, Spit Up and Swallow. Spit Up releases the stored energy to deal damage to the opponent, while Swallow consumes the stored energy to heal the user. Both the healing and damage effects are dependent on the number of times Stockpile has been used, up to a maximum of three. This move is favored for strategic play to boost defensive stats and provide versatile options in battle."
move,spit-up,"**Spit Up** is a Normal-type move with variable power and 100% accuracy. The power of Spit Up depends on the number of times the user has used the move Stockpile prior to using Spit Up; it can reach up to 300 power if three Stockpiles have been consumed. Spit Up consumes all Stockpile boosts, returning the user's defenses to normal. It is typically used in combination with the move Stockpile to unleash powerful attacks, making it a strategic choice in battles that involves setup."
move,swallow,"**Swallow** is a Normal-type move with no power or accuracy since it doesn't deal damage. Instead, it allows the user to restore its HP based on the amount of energy stored with Stockpile. Swallow consumes the Stockpile count, healing the user by an amount proportional to the number of times Stockpile was used—one Stockpile restores 25% of maximum HP, two Stockpiles restore 50%, and three Stockpiles restore 100%. After Swallow is used, the Stockpile count resets to zero. It is a strategic move often paired with the move Stockpile to provide a recovery option in battles."
move,heat-wave,"**Heat Wave** is a Fire-type move with 95 power and 90% accuracy. It has a 10% chance of burning the target. Heat Wave is notable for being a spread move, affecting all adjacent opponents in double and triple battles. This makes it particularly useful in multi-battle formats, where its ability to hit multiple targets can deal significant damage and apply pressure. Additionally, Heat Wave is a common move for Fire-type Pokémon that have high Special Attack stats, and it is often utilized due to its balance of power and reliability. Some Pokémon with access to Heat Wave through breeding or move tutors include Charizard, Volcarona, and Talonflame."
move,hail,"**Hail** is an Ice-type move with no power or accuracy because it is a status move rather than a damaging move. When used, it creates a hailstorm that lasts for five turns. During the hailstorm, all Pokémon that are not Ice-type will lose a small amount of their HP at the end of each turn. Hail also enables certain moves, like Blizzard, to hit with 100% accuracy and activates abilities such as Ice Body, which restores HP, and Snow Cloak, which increases evasion. Hail can also transform the move Weather Ball into an Ice-type attack and doubles its power. Hail is often utilized in strategies that revolve around weather conditions, particularly in teams featuring Ice-type Pokémon."
move,torment,"**Torment** is a Dark-type move with no power or accuracy stat because it does not directly deal damage. Instead, Torment prevents the target from using the same move consecutively, which can severely disrupt an opponent's strategy by forcing them to alternate their moves. This is particularly useful against Pokémon that rely heavily on a single powerful move. Torment has 100% accuracy, meaning it will always hit the target unless they are under a protective effect like Fly or Dig. It's often used in competitive play to add an extra layer of strategy and can be combined effectively with other disruptive moves to control the flow of battle."
move,flatter,"**Flatter** is a Dark-type move that does not cause direct damage; hence, it has no power value associated with it. Flatter has 100% accuracy, ensuring it successfully hits the target. When used, Flatter confuses the target Pokémon but also raises its Special Attack by one stage. This can make the move a double-edged sword, as it boosts the opponent's offensive capability while inflicting confusion. The move is often strategically used in doubles battles to manipulate the battlefield or in combination with abilities and items that take advantage of an opponent's confusion."
